{
  "contract": {
    "name": "b44.design_guide_packet",
    "version": "1.0",
    "compatibility": "additive_to_b44_asset_handoff"
  },
  "guide_identity": {
    "guide_id": "sample:lumaloop-ai-pitch-deck-guide",
    "guide_version": "1.0.0",
    "status": "sample_public_fixture",
    "language": "en-US",
    "project_name": "LumaLoop AI",
    "topic": "IR pitching deck for a Silicon Valley AI B2C startup targeting teens and twenty-somethings",
    "slide_count": 15,
    "created_at": "2026-04-27T00:00:00Z"
  },
  "project_brief": {
    "audience": ["seed investors", "Series A investors", "consumer AI operators"],
    "tone": ["bright", "social", "fast", "credible", "mobile first", "AI native"],
    "objective": "Create a 15-slide investor pitch deck that explains a youth-focused AI social creation product before native PowerPoint assembly.",
    "constraints": [
      "Use public-safe metadata only.",
      "Do not reuse source embedded images.",
      "Do not treat the HTML guide preview as slide content.",
      "Use approved package assets only when a manifest is present and checksums validate."
    ]
  },
  "reference_files": [
    {
      "file_name": "PPT_MAKER_PRESENTATION_DESIGN_GUIDE_SAMPLE.html",
      "extension": ".html",
      "purpose": "Human review preview generated from guide data.",
      "public_safe_note": "Preview is layout evidence only and must not be screenshotted into the deck."
    },
    {
      "file_name": "PPT_MAKER_PRESENTATION_DESIGN_GUIDE_SAMPLE.machine.md",
      "extension": ".md",
      "purpose": "Machine-facing rendering notes mirrored by this JSON packet.",
      "public_safe_note": "No private paths, Drive identifiers, raw private records, or unapproved assets."
    }
  ],
  "palette": {
    "palette_id": "sample-lumaloop-five-token",
    "palette_name": "LumaLoop Bright Mobile Pitch",
    "source": {
      "kind": "sample_fixture",
      "asset_ref": null
    },
    "colors": [
      {
        "role": "main",
        "name": "Electric Blue",
        "hex": "#315CFF",
        "rgb": [49, 92, 255],
        "usage": "Primary accent for the most important action, section signal, or hero emphasis.",
        "accessibility_note": "Use white text on solid Electric Blue for short labels; avoid long body copy on this accent.",
        "contrast": {
          "recommended_text_color": "white",
          "wcag_normal_text_aa": true,
          "wcag_large_text_aa": true
        }
      },
      {
        "role": "support",
        "name": "Signal Pink",
        "hex": "#FF4DA6",
        "rgb": [255, 77, 166],
        "usage": "Secondary accent for social energy, creator moments, and selected highlights.",
        "accessibility_note": "Use sparingly and pair with Ink for nearby explanatory text.",
        "contrast": {
          "recommended_text_color": "ink",
          "wcag_normal_text_aa": false,
          "wcag_large_text_aa": true
        }
      },
      {
        "role": "accent",
        "name": "Mint",
        "hex": "#22C7A9",
        "rgb": [34, 199, 169],
        "usage": "Positive growth, success, and healthy loop indicators.",
        "accessibility_note": "Use for icons, chips, and chart accents; pair with Ink text for normal copy.",
        "contrast": {
          "recommended_text_color": "ink",
          "wcag_normal_text_aa": true,
          "wcag_large_text_aa": true
        }
      },
      {
        "role": "background",
        "name": "Cloud",
        "hex": "#F7F8FC",
        "rgb": [247, 248, 252],
        "usage": "Default slide background and low-noise card fill.",
        "accessibility_note": "Use Ink for normal text on Cloud.",
        "contrast": {
          "recommended_text_color": "ink",
          "wcag_normal_text_aa": true,
          "wcag_large_text_aa": true
        }
      },
      {
        "role": "neutral",
        "name": "Ink",
        "hex": "#101828",
        "rgb": [16, 24, 40],
        "usage": "Primary readable text, dense labels, and outlines.",
        "accessibility_note": "Use on Cloud or white backgrounds for accessible normal text.",
        "contrast": {
          "recommended_text_color": "not_applicable",
          "wcag_normal_text_aa": true,
          "wcag_large_text_aa": true
        }
      }
    ]
  },
  "typography": {
    "font_package_refs": [
      {
        "family": "Inter",
        "asset_ref": "font-family:inter",
        "license_action": "check-license-file",
        "package_status": "metadata_only"
      },
      {
        "family": "Pretendard",
        "asset_ref": "font-family:pretendard",
        "license_action": "check-license-file",
        "package_status": "metadata_only"
      }
    ],
    "roles": [
      {
        "role": "hero_title",
        "font_stack": ["Inter", "Pretendard", "Aptos", "Arial", "Noto Sans KR", "sans-serif"],
        "default_pt": 52,
        "min_pt": 44,
        "max_pt": 60,
        "weight": "bold",
        "line_limit": 2,
        "fallback": "Aptos Display"
      },
      {
        "role": "slide_title",
        "font_stack": ["Inter", "Pretendard", "Aptos", "Arial", "Noto Sans KR", "sans-serif"],
        "default_pt": 34,
        "min_pt": 28,
        "max_pt": 40,
        "weight": "bold",
        "line_limit": 2,
        "fallback": "Aptos"
      },
      {
        "role": "metric",
        "font_stack": ["Inter", "Pretendard", "Aptos", "Arial", "Noto Sans KR", "sans-serif"],
        "default_pt": 42,
        "min_pt": 34,
        "max_pt": 52,
        "weight": "bold",
        "line_limit": 1,
        "fallback": "Aptos Display"
      },
      {
        "role": "body",
        "font_stack": ["Inter", "Pretendard", "Aptos", "Arial", "Noto Sans KR", "sans-serif"],
        "default_pt": 18,
        "min_pt": 14,
        "max_pt": 22,
        "weight": "regular",
        "line_limit": 4,
        "fallback": "Aptos"
      },
      {
        "role": "caption",
        "font_stack": ["Inter", "Pretendard", "Aptos", "Arial", "Noto Sans KR", "sans-serif"],
        "default_pt": 12,
        "min_pt": 10,
        "max_pt": 14,
        "weight": "regular",
        "line_limit": 2,
        "fallback": "Aptos"
      }
    ]
  },
  "slide_size": {
    "size": "widescreen_16_9",
    "width_in": 13.333,
    "height_in": 7.5
  },
  "safe_area": {
    "left_in": 0.35,
    "top_in": 0.28,
    "right_in": 12.98,
    "bottom_in": 7.22
  },
  "background_policy": {
    "default_mode": "single_solid_cloud",
    "max_modes_per_deck": 3,
    "allowed_types": ["solid", "subtle_gradient", "approved_image", "generated_image", "user_supplied_image", "approved_pattern"],
    "forbidden_types": ["source_embedded_image", "html_preview_image", "unknown_stock_image"]
  },
  "header_footer_policy": {
    "header": {
      "mode": "optional",
      "allowed_content": ["short slide title", "section label"]
    },
    "footer": {
      "mode": "optional",
      "allowed_content": ["page number", "short source note when needed"]
    }
  },
  "slide_plan": {
    "slides": [
      {
        "slide_no": 1,
        "layout_archetype": "cover",
        "content_brief": "Introduce LumaLoop AI as the social creation loop for mobile-native youth.",
        "visible_content_candidates": ["LumaLoop AI", "AI social creation loops for the next generation"],
        "asset_slots": [
          {
            "slot_id": "hero_mockup",
            "slot_type": "mockup",
            "required": false,
            "allowed_sources": ["approved_package_asset", "generated_image_approved_for_deck", "native_shape_or_mockup_fallback"],
            "preferred_asset_ref": null,
            "fallback": "Render an editable native phone UI mockup.",
            "crop_or_mask_policy": "If a real mockup image is approved, fit it inside the mockup bounds with contain behavior and preserve aspect ratio; if using native fallback, build the frame from editable shapes.",
            "visible_text_allowed": false
          }
        ],
        "qa_checks": ["No HTML screenshot", "No layout placeholder text"]
      },
      {
        "slide_no": 2,
        "layout_archetype": "big_thesis",
        "content_brief": "State the thesis that Gen Z will not experience AI as a blank chat box.",
        "visible_content_candidates": ["AI will not live in a blank chat box for Gen Z."],
        "asset_slots": [],
        "qa_checks": ["Text fits within two title lines"]
      },
      {
        "slide_no": 3,
        "layout_archetype": "three_cards",
        "content_brief": "Explain three pain points in current AI tools for teen social life.",
        "visible_content_candidates": ["Too blank", "Too private", "Too slow to share"],
        "asset_slots": [
          {
            "slot_id": "problem_icons",
            "slot_type": "icon",
            "required": false,
            "allowed_sources": ["approved_package_asset", "native_shape_or_mockup_fallback"],
            "preferred_asset_ref": null,
            "fallback": "Use simple native line icons.",
            "crop_or_mask_policy": "Not applicable for native line icons; if an approved icon file is used, preserve aspect ratio and center within the icon bounds.",
            "visible_text_allowed": false
          }
        ],
        "qa_checks": ["Cards maintain equal width", "Icon fallback recorded if used"]
      },
      {
        "slide_no": 4,
        "layout_archetype": "behavior_shift",
        "content_brief": "Show that the target audience creates before it searches.",
        "visible_content_candidates": ["Gen Z creates before it searches.", "Creation is the new intent signal."],
        "asset_slots": [
          {
            "slot_id": "edge_bleed_visual",
            "slot_type": "image",
            "required": false,
            "allowed_sources": ["approved_package_asset", "generated_image_approved_for_deck", "native_shape_or_mockup_fallback"],
            "preferred_asset_ref": null,